title,selftext,subreddit,created_utc,name
"Iowa State agencies to enhance existing childhood nutrition programs, decline Summer EBT participation",,democrats,1703283964.0,t3_18oqn8j
Biden pardons marijuana use nationwide. Here's what that means,This is a bipartisan and *WINNING* issue.,democrats,1703272662.0,t3_18ommys
Is there a definition?,,democrats,1703268439.0,t3_18ol28f
Obama helps Biden campaign raise nearly $4 million from grassroots donors | CNN Politics,,democrats,1703267492.0,t3_18okp5z
"Wait, What? Biden’s Ahead?",,democrats,1703266435.0,t3_18okamg
"Opinion | Congress, Wrapped! 2023.",,democrats,1703258208.0,t3_18oh7qb
Biden is pardoning thousands convicted of marijuana charges on federal lands and in Washington,,democrats,1703256653.0,t3_18ogmwp
Stop For-Profit Takeover of Organ Donation: Make Congress Protect Lives! Senators Grassley and Moran are allowing corporations to run the US transplant process.,,democrats,1703252329.0,t3_18of4q8
AT Last Americans Are Discovering That This Is The Best Economy Of Their Lives,,democrats,1703250094.0,t3_18oeetw
‘Bullseye’: Trump’s Colorado ballot banishment accords with Constitution top Dem says,,democrats,1703221174.0,t3_18o6zgf
Recording surfaces of Trump pressuring Michigan officials not to certify 2020 election,,democrats,1703220314.0,t3_18o6qta
“slam dunk a judge’s baby into the trash can” - pro lifers,,democrats,1703213993.0,t3_18o4ufd
Democrats Call For Justice Clarence Thomas' Recusal In Trump Immunity Case,,democrats,1703202759.0,t3_18o12pl
GOP Lawmaker Says His Colleagues Are Compromised,,democrats,1703194028.0,t3_18nxt2g
Giuliani receives online 'credit counseling' after filing for bankruptcy,,democrats,1703187226.0,t3_18nv77v
This..,,democrats,1703184187.0,t3_18nu0dv
No wonder from the death cult,,democrats,1703184607.0,t3_18nu64o
Rudy Giuliani files for Chapter 11 bankruptcy in New York after defamation case,"To quote *The Simpsons*’ Nelson Muntz, “Ha ha!”",democrats,1703184268.0,t3_18nu1h1
"How President Biden's Mother Encouraged Him to Be Obama’s Running Mate: 'He Says He Needs You' — Biden said his mother, Catherine Finnegan, was the first person he called after Obama asked him to consider being his vice president",,democrats,1703178268.0,t3_18nrqjm
12 states where the fate of abortion rights could be on 2024 ballots,,democrats,1703177113.0,t3_18nraxz
"GOP voter-fraud crackdown overwhelmingly targets minorities, Democrats",,democrats,1703168562.0,t3_18no5ic
'The NRA today is in a dismal state' as cash dries up and they plunge 'deep into the red',,democrats,1703164194.0,t3_18nmo9u
"Former Georgia election workers can go after Giuliani’s assets immediately, judge says | CNN Politics",,democrats,1703159210.0,t3_18nl7g0
Jan. 6 rioter nabbed in Bumble dating app sting pleads guilty to assaulting officers,,democrats,1703158908.0,t3_18nl4gc
"Home Sales Unexpectedly Rise in November. That Ends a 13-Year Low. - Sales of previously owned homes unexpectedly inched up in November, snapping a five-month slump and ending a 13-year low.",,democrats,1703132090.0,t3_18ne30m
Kate Cox abortion ruling isn't enough for Texas' Christian activists,,democrats,1703130029.0,t3_18ndfpv
Young voters right now overwhelmingly prefer Biden: The Economist/YouGov poll,,democrats,1703106416.0,t3_18n58cd
Crime Rates Plummeted in 2023 Despite GOP Narrative,,democrats,1703102466.0,t3_18n3q3l
"GOP voter-fraud crackdown overwhelmingly targets minorities, Democrats",,democrats,1703097001.0,t3_18n1kg4
Biden: ‘No question’ Trump supported insurrection in light of Colorado ruling,,democrats,1703095083.0,t3_18n0ria
Trump's Hitler fantasies put Senate Republicans on defense,,democrats,1703083035.0,t3_18mw1z7
Put one on the scoreboard for President Biden,,democrats,1703059003.0,t3_18mpbul
Historic Ruling: Colorado Supreme Court Disqualifies Trump from 2024 Ballot,,democrats,1703053865.0,t3_18mo1ms
Colorado Supreme Court removes Trump from state’s 2024 ballot,,democrats,1703045605.0,t3_18mllfa
Pope Francis Sparks Controversy Among MAGA Supporters with Historic Announcement,,democrats,1703041579.0,t3_18mkaaj
Sen. Tillis to introduce legislation barring federal funds from states ‘misusing’ 14th Amendment,,democrats,1703040284.0,t3_18mjumd
"Schumer stamps out final Tuberville military holds, ending months-long standoff",,democrats,1703039145.0,t3_18mjh3j
"Schumer stamps out final Tuberville military holds, ending months-long standoff",,democrats,1703034787.0,t3_18mhzyp
Trump Blocked from CO 2024 Ballots,,democrats,1703034118.0,t3_18mhrzy
Federal judge orders documents naming Jeffrey Epstein's associates to be unsealed,,democrats,1703033199.0,t3_18mhghi
Donald Trump banned from Colorado ballot in historic ruling by state's Supreme Court,,democrats,1703033050.0,t3_18mhemf
Colorado Supreme Court rules Trump is disqualified from presidency for Jan. 6 riot,,democrats,1703029976.0,t3_18mgbov
Colorado Supreme Court removes Trump from 2024 ballot based on 14th Amendment’s ‘insurrectionist ban’,,democrats,1703029936.0,t3_18mgb7d
Colorado Supreme Court removes Trump from 2024 ballot based on 14th Amendment’s ‘insurrectionist ban’ | CNN Politics,,democrats,1703029199.0,t3_18mg1s6
"Donald Trump is barred from Colorado’s 2024 primary ballot, the state Supreme Court rules",,democrats,1703028586.0,t3_18mftix
"Trump Is Disqualified From the 2024 Ballot, Colorado Supreme Court Rules",,democrats,1703028023.0,t3_18mflzh
"Colorado Supreme Court disqualifies Trump from 2024 ballot, pauses ruling to allow appeal",,democrats,1703027787.0,t3_18mfiqw
Analysis | New details emerge showing secrecy from White House on planned march on Jan. 6,,democrats,1703026590.0,t3_18mf2c8
Raising a family in a Red State sucks,,democrats,1703013612.0,t3_18ma02k
Texas city is latest to debate ban on using roads to transport people seeking abortions,,democrats,1703012085.0,t3_18m9e2k
Texas city is latest to debate ban on using roads to transport people seeking abortions | Texas,,democrats,1703011954.0,t3_18m9c6i
Texas Becomes an Abortion Dystopia,,democrats,1703011470.0,t3_18m958t
Texas group pulls 23 books about slavery from plantation,,democrats,1703010179.0,t3_18m8mmq
Texas companies say Republicans are ruining their business,,democrats,1703009492.0,t3_18m8cs2
GOP Branding,,democrats,1703004212.0,t3_18m6a2r
‘2024 is not a repeat of 2020’: how the Biden campaign hopes to energize Black voters,,democrats,1702998007.0,t3_18m3vbj
"Ohio Republicans plot to thwart voters who backed 'immoral and evil' abortion rights - Voters in Ohio earlier this year overwhelmingly backed an amendment to enshrine abortion rights in their state's constitution, but Republicans in the state are plotting to thwart their wishes.",,democrats,1702993874.0,t3_18m2ctf
First NYT/Siena poll shows Biden leading Trump 47/45 among likely voters,,democrats,1702992422.0,t3_18m1up9
Enough said,,democrats,1702979449.0,t3_18ly9cb
"Immigrants in Florida: ""We'll vote for ya!""",,democrats,1702967267.0,t3_18lvau8
Are you kidding me?,,democrats,1702961287.0,t3_18ltjk4
"Donald Trump defends former influencer convicted of election interference who has racist, antisemitic past | CNN Politics",This guy just keeps doubling down,democrats,1702950956.0,t3_18lq4o7
Rudy Giuliani sued again by former election workers who now want a court order against further defamatory remarks,,democrats,1702944840.0,t3_18lnz5y
Democratic legislative achievements have made landmark investments in taking care of our nations veterans.,,democrats,1702942386.0,t3_18ln21c
No Labels Is Pushing a Lie That Will Elect Trump,,democrats,1702924662.0,t3_18lfy3c
Clarence Thomas’ Private Complaints About Money Sparked Fears He Would Resign,,democrats,1702924585.0,t3_18lfx0x
"Ohio Supreme Court smacks down state attorney general's attempt to enforce a ""fetal heartbeat"" ban *after* voters approved Issue 1, which enshrined abortion rights into the state constitution",,democrats,1702918702.0,t3_18ldifi
Everyone expected a recession. The Fed and White House found a way out.,,democrats,1702914174.0,t3_18lbpwp
Texas Becomes an Abortion Dystopia,,democrats,1702912868.0,t3_18lb7jd
"Jan. 6 officer: Republicans would ""keep us from protecting the Capitol"" if Trump tries another coup",,democrats,1702910191.0,t3_18la63p
Conservatives move to keep abortion off the 2024 ballot,,democrats,1702906198.0,t3_18l8psb
Solar and Wind to Top Coal Power in US for First Time in 2024,,democrats,1702870660.0,t3_18kz8wp
Biden safe after car crashes into parked SUV in his motorcade outside Delaware campaign HQ,,democrats,1702870340.0,t3_18kz5en
President Biden safe but startled after car plows into motorcade,,democrats,1702868652.0,t3_18kymp6
Dean Phillips' once strong standing on Capitol Hill has all but collapsed,,democrats,1702857685.0,t3_18kv4re
"Texas power plants have no responsibility to provide electricity in emergencies, judges rule",,democrats,1702842583.0,t3_18kpile
Graham says Biden impeachment inquiry narrative ‘falling apart’,,democrats,1702835194.0,t3_18kmr5e
Donald Trump Faces Backlash After Claiming Immigrants from Africa and Asia are 'Poisoning the Blood' of United States,,democrats,1702834773.0,t3_18kmlld
This is truly Hitler speech and territory,I know he can’t keep his mouth shut but damn Hitler Jr,democrats,1702833956.0,t3_18kmahg
Most people think the U.S. crime rate is rising. They're wrong.,,democrats,1702830389.0,t3_18kky85
"Republicans likely to lose House control in 2024, GOP strategist predicts",,democrats,1702829985.0,t3_18kkst5
Marc Elias: There Are No Moderate Republicans. There Are Either Proud MAGA Or Scared MAGA.,,democrats,1702819134.0,t3_18kh6lp
Lawsuit Claims CPAC Ignored Past Sexual Misconduct Allegations By Matt Schlapp,,democrats,1702773818.0,t3_18k539y
Blackwoman charged in miscarriage in Ohio.,Imagine having to go through all that. Then getting charged.,democrats,1702771636.0,t3_18k4dfy
Florida’s Surgeon General told the FDA that COVID vaccines aren’t safe. The FDA calls that misinformation.,,democrats,1702745615.0,t3_18jvala
Pregnant Texans Continue to Be Pulled Over in Carpool Lane After Abortion Ruling: 'I Have Two Heartbeats in the Car',,democrats,1702744539.0,t3_18jux4x
DeSantis Says Trump Will Lie About 2024 Election Results ‘No Matter What,,democrats,1702742998.0,t3_18judty
Donald Trump Calls Republican Antigay Bigot Mark Robinson 'Better' Than MLK,,democrats,1702742135.0,t3_18ju2xi
The mystery of the missing binder: How a collection of raw Russian intelligence disappeared under Trump,,democrats,1702737511.0,t3_18jsjrc
How can I contribute?,,democrats,1702736579.0,t3_18js90g
"Republican Senator Markwayne Mullin Undermines Party's Impeachment Push Against Biden, Asserts Pre-2020 Actions Unimpeachable",,democrats,1702735225.0,t3_18jrsxr
‘The venom of our age’: James Carville on the danger of Mike Johnson’s Christian nationalism | US politics,,democrats,1702732359.0,t3_18jqy5j
Shadow majority: House Democrats outvoted GOP on every major bill passed,,democrats,1702733708.0,t3_18jrc5q
House GOP reeling after a top recruit blasts Trump on tape,,democrats,1702720755.0,t3_18jo2xa
The dangerous cult,,democrats,1702714710.0,t3_18jmpz2
Pete Buttigieg: Mike Johnson Should Focus on His Job and Less on Taking Away LGBTQ+ Rights,,democrats,1702698758.0,t3_18jii77
Jurors were in tears as poll worker described defamation by Giuliani: reporter,,democrats,1702690158.0,t3_18jfw01
What if Dems were as brutal as Cons?,,democrats,1702677303.0,t3_18jbdaw
Impeachment vote boosts Biden campaign fundraising,,democrats,1702676979.0,t3_18jb942
Jury Orders Giuliani to Pay $148 Million to Election Workers He Defamed,,democrats,1702675709.0,t3_18jas40
"'I'm not a progressive': Fetterman breaks with the left, showing a maverick side",,democrats,1702662513.0,t3_18j5t4f
Spot the difference,,democrats,1702659390.0,t3_18j4me3
Biden and Obama team up for Obamacare enrollment push following Trump’s latest repeal threat | CNN Politics,,democrats,1702660787.0,t3_18j55iq
Jamie Raskin blows up the House GOP’s Biden impeachment fantasy,,democrats,1702659998.0,t3_18j4v0x
"Embattled Florida GOP chair demands buyout to quit, party members say",,democrats,1702656966.0,t3_18j3pk5
Texas found startling amounts of a cancer-causing chemical in the air outside Houston. Nobody told the residents.,,democrats,1702656929.0,t3_18j3p2g
"Texas abortion law’s wording is causing dangerous confusion over emergency medical exceptions, critics say",,democrats,1702656643.0,t3_18j3lcb
Wyden Leads Colleagues in Urging HHS to Finalize and Swiftly Implement Rule to Better Support and Protect LGBTQIA+ Foster Children and Youth | The United States Senate Committee on Finance,,democrats,1702653619.0,t3_18j2gkx
Why Trump Won’t Win,,democrats,1702653280.0,t3_18j2c4z
Wyden Leads Democratic Colleagues in Introducing Billionaires Income Tax: Legislation cosponsored by 15 Democratic Senators would close loopholes in the tax code that let billionaires avoid paying their fair share,,democrats,1702651987.0,t3_18j1uyc
Worst. Congress. Ever.,,democrats,1702650991.0,t3_18j1i06
"Paul Ryan Labels Trump as an “Authoritarian Narcissist,” Not a Conservative",,democrats,1702650787.0,t3_18j1fh7
"ICYMI: At Hearing, Senator Warren Highlights Biden-Harris Administration’s Supply Chain Commitments, Calls for Public Manufacturing of Generic Drugs to Lower Costs for Consumers",,democrats,1702647349.0,t3_18j08r2
Congress approves bill barring any president from unilaterally withdrawing from NATO |,,democrats,1702609136.0,t3_18iq3vg
"House passes crucial defense bill in last-minute sprint, providing a pay raise for troops, Ukraine funding",,democrats,1702604373.0,t3_18iol8g
Moms For Liberty Is Tearing Itself Apart,,democrats,1702603984.0,t3_18iogp9
Biden administration to impose inflation penalties on dozens of drugs,,democrats,1702595393.0,t3_18ili6s
Ayanna Pressley Introduces Bill to Counter Book Bans Nationwide,,democrats,1702594853.0,t3_18ilaqd
"A decade later... Nothing has changed, except the names of the victims (Thanks to the GOP)",,democrats,1702592146.0,t3_18ik9jd
Red States Have Higher Gun Death Rates Than Blue States. Here’s Why,,democrats,1702592226.0,t3_18ikao9
Media Bias Chart Debuts 10 Shows on December’s Podcast Edition,I remember someone was looking for a rating for NPR.,democrats,1702586584.0,t3_18ii6f2
Media Matters Sues Far-Right Texas Attorney General Ken Paxton,,democrats,1702583766.0,t3_18ih45j
Retirement Without a Net: The Plight of America’s Aging Farmworkers,,democrats,1702578836.0,t3_18ifa5u
Dozens of Texas businesses back challenge to abortion ban: ‘This is why our economy is taking a hit’,,democrats,1702572311.0,t3_18icsef
Colin Allred on his race to take on Ted Cruz in Texas,,democrats,1702572248.0,t3_18icriw
Running in a rural Ohio district with great results for issues one and two. Could use some sharing and donations to flip the district.,,democrats,1702572138.0,t3_18icq2x
Mom's for Liberty Co-Founder Won't Resign from School Board Over Husband's Rape Allegations,,democrats,1702567416.0,t3_18ib0bn
Judge pauses Trump’s Jan. 6 case amid appeal to toss it |,💩💩💩💩💩,democrats,1702566552.0,t3_18iap7l
"Supreme Court will hear a case that could undo Capitol riot charge against hundreds, including Trump",,democrats,1702565730.0,t3_18iae61
Nothing says desperation like GOP strategists counseling Republicans to support contraception access,,democrats,1702563845.0,t3_18i9pyk
Florida abortion rights supporters inch closer to ballot measure threshold,,democrats,1702563689.0,t3_18i9o17
Some 2024 GOP hopefuls call for 'compassion' in Texas abortion case but don't say law should change,,democrats,1702557103.0,t3_18i7mqu
"Post, the Social Media Company, Is Being Praised for Protecting LGBTQ+ Users From Bigots",,democrats,1702553495.0,t3_18i6o44
Rep. Garcia: Why Did Saudi Government Give Kushner $2 Billion? | Congressman Robert Garcia,Why is no one talking about this grift?,democrats,1702549816.0,t3_18i5rav
Fox News Hosts say Republicans Have No Evidence to impeach Joe Biden.,"Republicans are an absolute disgrace to this country. But, don't worry, cause most Americans will make the right vote on November 5, 2024. They will be tired of these Republicans wasting time and money on baseless accusations. All this is taking $$$ out of taxpayers bank accounts.",democrats,1702533806.0,t3_18i1zqt
House Republican admits vote for Biden impeachment inquiry despite lack of evidence is for election.,"This will go nowhere. Plus, Republicans are just POS.",democrats,1702532377.0,t3_18i1lgr
"Emulating Trump, Republicans adopt fundamental indecency as core principle: Rep. Schiff",,democrats,1702531468.0,t3_18i1cr3
"My brother Vivek, you are the type of person that the neo nazis say are replacing them. I don’t get this",,democrats,1702529006.0,t3_18i0nca
New York’s high court just blew up the fight for control of the House,,democrats,1702523786.0,t3_18hz38j
They’ve got nothin.,,democrats,1702519356.0,t3_18hxntb
We can absolutely support Ukraine AND take care of our own people: but ONLY with a Democratic majority. Republicans only pretend they care about you.,,democrats,1702514089.0,t3_18hvw0o
Republicans admit: they have zero evidence to impeach.,,democrats,1702513326.0,t3_18hvmqx
"It's a 'silly notion' that Trump's Georgia case should pause for the election, Willis tells the AP",,democrats,1702512612.0,t3_18hvdq6
Nikki Haley,Is it wrong to point out that Haley often speaks through closed teeth? It’s kind of unsettling.,democrats,1702510514.0,t3_18humk5
Republicans Vote To Authorize Biden Impeachment Inquiry,,democrats,1702510048.0,t3_18hug9e
60+ Groups Are Spreading Anti-LGBTQ+ Pseudoscience Across the Country: Report,,democrats,1702506033.0,t3_18hsx09
"After pause, this Texas city is set to reconsider banning travel to access an abortion",,democrats,1702504677.0,t3_18hsd9z
Abortion Ruling Keeps Texas Doctors Afraid of Prosecution,,democrats,1702504344.0,t3_18hs8of
"Fed interest rate decision December 2023: Fed holds rates steady, indicates 3 cuts coming in 2024",Looks like Republicans are gonna loose another political talking point,democrats,1702501293.0,t3_18hr2xp
Best we can do for you.,,democrats,1702500720.0,t3_18hquvp
Army of Trump trolls runs online campaign with flood of hateful posts: report,"When the current GOP front-runner rewards this behavior and the rest of them normalize it, we truly are entering dystopian times.",democrats,1702487823.0,t3_18hlt2j
Florida school board votes for Moms for Liberty co-founder and three-way sex swinger Bridget Ziegler to resign,,democrats,1702482601.0,t3_18hjsgd
Dean Phillips’ presidential bid proving to be ‘a pro-Trump effort disguised as a primary campaign’,,democrats,1702477001.0,t3_18hhqx5
Gov. Gretchen Whitmer's fight for abortion rights helped turn Michigan blue. She's eyeing national impact now - CBS,,democrats,1702466715.0,t3_18hepvq
Texas Sens. Ted Cruz and John Cornyn avoid questions about Kate Cox abortion case,,democrats,1702446425.0,t3_18h9w8p
Biden warns Netanyahu that Israel is losing support worldwide and its government must 'change',,democrats,1702436056.0,t3_18h6qze
Democrats want to kick Corporare landlords out of the housing market to improve affordability...Note: It's two bills they are proposing. It's not a given.,This proposal will be highly contested most likely. It's something to consider and continue at another date.,democrats,1702435915.0,t3_18h6pah
Senate Democrats press Thomas to recuse himself from Trump immunity case,,democrats,1702430252.0,t3_18h43z3
Consumer Confidence Increasing: CPI Flat in November; Inflation Falls to 3.1%,"Yes, the economy is healthy and Americans are beginning to feel it",democrats,1702429822.0,t3_18h3vuj
Supreme Court allows Texas county to use a map judges deemed a racial gerrymander,The supreme Court Trump loyalists strike again,democrats,1702429793.0,t3_18h3vb4
A fact-based response to anyone who claims Biden has accomplished nothing…,"Feel free to use this response. I’m open to critiques as well. I find that the loudest people claiming Biden has accomplished nothing, or has governed from the center-right, are young leftists, who (imho) are most likely to cost us the election by voting for a third party candidate or refusing to vote at all. 

*Response below:*

Biden’s record includes:

- $1.2 Trillion Bipartisan Infrastructure Bill
- CHIPS Act
- ⁠$891 Billion Inflation Reduction Act

These bills alone are going to fundamentally transform the U.S. economy over the next decade, including a projected 40% reduction in greenhouse gas emissions by 2030. We’re finally updating our nation’s crumbling infrastructure after decades of presidents promising and failing to do so. We’re even rebuilding our industrial manufacturing base.

Biden is undoubtedly the most progressive, productive, and effective Democrat since LBJ. And he accomplished all of this with razor thin Congressional majorities and an opposition party that wants to destroy the federal government. No other 2020 candidate could have accomplished Biden’s historic record. Sometimes age, wisdom, and experience pay off.",democrats,1702427720.0,t3_18h2sf9
"Top Court Clears Path for Democrats to Redraw House Map in New York, Possibly Tilting House Control Out of GOP Hands",,democrats,1702422336.0,t3_18gzvo8
Moms for Liberty Co-Founder to Address Sexual Hypocrisy Scandal at Florida School Board Meeting,,democrats,1702421333.0,t3_18gzb5h
"Jennifer Finney Boylan, Transgender Author & Advocate, Elected President of PEN America",,democrats,1702419511.0,t3_18gybd5
Rally for Kate,,democrats,1702414909.0,t3_18gwajh
New York's high court orders new congressional maps as Democrats move to retake control of US House,,democrats,1702413354.0,t3_18gvp0b
Johnson we owe it to the people to undertake this process methodically and transparently.” GOP votes against Transparency,Biden impeachment hearing is a kangaroo court.,democrats,1702411010.0,t3_18gusa3
"The roaring 20's are back, and a 30% rally in the S&P 500 is coming in the next 2 years, market veteran says",,democrats,1702410707.0,t3_18guo0v
Missouri Republicans propose bills to allow murder charges for women who get abortions,,democrats,1702406594.0,t3_18gt1ks
Biden has a strong economy yet the prima donnas of this country think prices are still you high.,"
To those that know nothing about economics. I suggest you read up about it. Oh, as for those high prices. You can thank the corporations for 
(greedflation). Instead of blaming it on Biden. There were a couple new articles about this put out last week. Read up on it.",democrats,1702406537.0,t3_18gt0rn
"US v. Trump will bring new political misery to the embattled Supreme Court, no matter what the justices do",,democrats,1702406532.0,t3_18gt0oz
Has anyone heard of “Project 2025”? It’s a conservative takeover plot which Trump supporters are cheering on. Just spreading awareness as we are about to enter 2024.,Please share around this article.,democrats,1702402587.0,t3_18grh1i
Texas Democrats urge DOJ intervention as ‘Operation Lonestar’ faces increased scrutiny,,democrats,1702402352.0,t3_18grdku
Kari Lake wanted Arizona to pass 'carbon copy' of Texas abortion law at center of legal fight,,democrats,1702401346.0,t3_18gqz2c
Trump Goes On Saturday Posting Bender That Includes Threat To Indict Obama — For ‘Murder’,,democrats,1702400283.0,t3_18gqjfm
George Santos Is in Plea Negotiations with Federal Prosecutors,,democrats,1702399050.0,t3_18gq22t
Inflation is slowly coming down and no longer outweighing Americans’ wages,,democrats,1702398713.0,t3_18gpxie
QOL in a Red State,,democrats,1702397269.0,t3_18gpd1v
Criminal indictment by administration,,democrats,1702397069.0,t3_18gpa6n
Special counsel reveals plans to use Trump’s phone data at trial,,democrats,1702382865.0,t3_18gkfzj
House expected to take vote on Biden impeachment inquiry,,democrats,1702356188.0,t3_18gdt70
"'I'm a Zionist': Biden reaffirms support for Israel, despite critics' calls for cease-fire",Common Biden win,democrats,1702354520.0,t3_18gdbai
This is a Nightmare that WE need to stand up and stop.,,democrats,1702350578.0,t3_18gc3g0
So Much for QOL in a Red State,,democrats,1702349992.0,t3_18gbwec
R/JoeRogan is now a safe space,,democrats,1702345776.0,t3_18gai7l
Florida Students Have Questions About the Ziegler Scandal. The Law Bridget Pushed Means Teachers Can’t Answer Them.,,democrats,1702340646.0,t3_18g8sqi
Discord Now Explicitly Bans Misgendering and Deadnaming Transgender People on the Platform,,democrats,1702339945.0,t3_18g8jsz
"Pennsylvania Library Director Resigns After Board Removes Issues of 'Out,' the LGBTQ+ Magazine",,democrats,1702338631.0,t3_18g82uc
Jack Smith asks SCOTUS to resolve if Trump can be prosecuted,This is a risky move by Jack. Pressuring  SCOTUS for an answer. I can't blamr him at all. I'm sure they have had discussions amongst themselves behind closed doors. They will not admit it if course. We need the courts to keep things moving along. Good luck Jack.,democrats,1702335223.0,t3_18g6tqg
Jury to decide how much Rudy Giuliani must pay election workers he defamed,,democrats,1702329050.0,t3_18g4bws
"Trump Intelligence Officials Unanimously Rejected His Election Claims, Smith Reveals",,democrats,1702324646.0,t3_18g2j88
I stand with Kate,,democrats,1702321354.0,t3_18g1693
Fox News Host Goes on Rant About Idiotic Biden Impeachment Efforts: Even Fox’s Steve Doocy couldn’t stomach the false claims about Republicans’ Biden impeachment inquiry.,,democrats,1702321104.0,t3_18g12c1
"Supreme Court Upholds State Bans on Conversion Therapy, Rejecting Washington Challenge",,democrats,1702319186.0,t3_18g0a15
"Trump’s Last-Minute Dodge: Shunning Testimony in Fraud Trial, Accuses Court of ‘Witch Hunt’",,democrats,1702313024.0,t3_18fytfc
