title,selftext,subreddit,created_utc,name
Some Republicans sound alarm after Trump revives focus on Obamacare,,democrats,1701376847.0,t3_187sjky
Judge key to Jan. 6 cases warns US faces 'authoritarian' threat,,democrats,1701373394.0,t3_187r61r
Some Republicans sound alarm after Trump revives focus on Obamacare | CNN Politics,,democrats,1701371448.0,t3_187qegk
"Florida GOP Chair Christian Ziegler, husband of Moms For Liberty cofounder, accused of sexual battery by alleged menage a trois lover",,democrats,1701371436.0,t3_187qeai
"EPA proposes rule to replace all lead water pipes in U.S. within 10 years: ""Trying to right a longstanding wrong""",,democrats,1701371383.0,t3_187qdjq
GOP Rep. George Santos refuses to resign and warns his expulsion from Congress would set a precedent,,democrats,1701371276.0,t3_187qc7r
John Cornyn and Ted Cruz flee U.S. Senate hearing as Democrats vote on Harlan Crow subpoena,,democrats,1701371230.0,t3_187qblh
More than 60 percent of Floridians favor constitutional amendment ensuring abortion access while less than 30 percent oppose,,democrats,1701370561.0,t3_187q20g
"Student loan forgiveness announced for 813,000 borrowers",Biden administration has canceled more than $127 billion in loan debt for nearly 3.6 million borrowers.,democrats,1701358133.0,t3_187l6ah
"Home Depot Founder Bernie Marcus Stuns Nation, Vows Unwavering Support for Trump Despite 91 Felony Charges",,democrats,1701352663.0,t3_187j4ka
Thank you President Biden!,,democrats,1701351464.0,t3_187ipwz
Some of Scott Perry's texts shown on line by the courts.,,democrats,1701347158.0,t3_187hcub
⚠️,,democrats,1701325128.0,t3_187brhf
Harris to attend COP28 after pushback over Biden skipping summit,,democrats,1701320359.0,t3_187abx1
"Good, I like voting the opposite of sociopaths who inherited their wealth",,democrats,1701318432.0,t3_1879q9c
Biden takes on Chicken tycoons with antitrust lawsuits.,Corporate greed increases prices for everyone and people blame Biden. People should know what they're talking about before blaming others. This is just one example.,democrats,1701317607.0,t3_1879h65
Ron DeSantis Wants to Repeal the Affordable Care Act and is Blocking Floridians From Receiving Affordable Health Care - Democrats,,democrats,1701316418.0,t3_18793he
Trump Caught Moving Money Around to Pay Massive Tax Bill,,democrats,1701304570.0,t3_1874xb5
⚠️,,democrats,1701289161.0,t3_186yz9u
"House Speaker Mike Johnson has ""reservations"" about expelling George Santos, says members should ""vote their conscience""",,democrats,1701285616.0,t3_186xmy7
"U.S. GDP grew at a 5.2% rate in the third quarter, even stronger than first indicated",,democrats,1701274039.0,t3_186syyw
'Students For Trump' Co-Founder Arrested For Allegedly Assaulting Woman With A Gun,,democrats,1701273912.0,t3_186sx1q
Ted Cruz Introduces Bill Limiting Pronouns and Names Despite Going by His Own Chosen Name,,democrats,1701273506.0,t3_186squy
Rupert Murdoch to be deposed in Smartmatic’s election defamation case against Fox News | CNN Business,,democrats,1701270702.0,t3_186rnus
"Hey media, stop bullying women who refuse to marry Republicans",,democrats,1701267997.0,t3_186qmdj
"Exclusive: Liz Cheney’s new book blasts GOP as ‘enablers and collaborators’ of Trump, whom one member called ‘Orange Jesus’ | CNN Politics",,democrats,1701260599.0,t3_186o6hn
"Remarks by President Biden on New Actions to Strengthen Supply Chains, Lower Costs for Families, and Help Americans Get the Goods They Need",,democrats,1701235153.0,t3_186hrg5
Recently Resigned NH Legislator Arrested In Legislative Voting Related Case,,democrats,1701224461.0,t3_186e6m8
Mike Lee Acknowledges Jan. 6 Rioter Was Probably Not A Fed,,democrats,1701223422.0,t3_186dte4
"McCarthy visited Mar-a-Lago after January 6 because staffers said Trump was 'not eating,' Liz Cheney writes in forthcoming book",,democrats,1701222941.0,t3_186dmxt
9 key races that could land Democrats the House majority in 2024,,democrats,1701218271.0,t3_186bxhl
Let someone talk long enough an the truth comes out: Trump finally pins the blame on Putin in new bid to stay out of jail,,democrats,1701217112.0,t3_186bh9a
The US tells Israel any ground campaign in southern Gaza must limit further civilian displacement,,democrats,1701212397.0,t3_1869m96
Biden looks to boost domestic drug manufacturing amid shortages,,democrats,1701210888.0,t3_186905u
Whitmer signs package to push Michigan to 100% clean energy by 2040,,democrats,1701203980.0,t3_186634b
Rupert Murdoch to be deposed in Smartmatic defamation case against Fox,,democrats,1701203361.0,t3_1865ui3
Georgie Porgie Puddin and Pie,"Ha! Apt nursery rhyme taunt for ol grifter George. 
Resolution to expel tabled bc… some reason. House adjourned. 
Ah.",democrats,1701202879.0,t3_1865nhl
American consumers more confident in November as holiday shopping season kicks into high gear,,democrats,1701198945.0,t3_18642u3
GOP Is Waging War on Student Voters. It Could Backfire Big Time,,democrats,1701197100.0,t3_1863bzd
Democrats nearly double Republicans in October fundraising,,democrats,1701193687.0,t3_1861ygu
Activist Thomas Kennedy Settles Lawsuit Against Gov. DeSantis Over Press Conference Ban,,democrats,1701190605.0,t3_1860qps
"More than 810,000 Texas children booted from Medicaid coverage",,democrats,1701192761.0,t3_1861ldz
A second Michigan Senate candidate says he was offered $20M to run against Rashida Tlaib,,democrats,1701192094.0,t3_1861bxv
Amazon touts ‘record-breaking’ sales in kickoff to holiday shopping season,,democrats,1701191837.0,t3_18618dh
Netanyahu is an albatross around Biden’s neck,,democrats,1701189847.0,t3_1860gd9
"Public perception has diverged from the economic data which is largely good, the fairest public assessments are made during Republican administrations, the least fair under Democratic administrations. Reality: the hard data shows the Biden economy has been resilient.",,democrats,1701185398.0,t3_185yoks
Biden looks to boost domestic drug manufacturing amid shortages,,democrats,1701176073.0,t3_185vdl0
Antagonisms flare as red states try to dictate how blue cities are run,,democrats,1701175599.0,t3_185v8g1
Libs of TikTok Is Livid Over Froot Loops Wanting Kids to Read,,democrats,1701173933.0,t3_185uq4w
The Supreme Court case seeking to shut down wealth taxes before they even exist,,democrats,1701173264.0,t3_185uj7z
"Trump's Fraud-Trial Judge Saves Him, Just This Once, From Himself",,democrats,1701173196.0,t3_185uij4
Biden Hopes to Alter the Trajectory of the War as Hostages Are Released,,democrats,1701161493.0,t3_185rlpw
"Trump supporters became more likely to express dehumanizing views of Black people after his 2016 victory, study finds. Those who viewed Trump favorably before the election were found to rate Black people as less “evolved” in the post-election survey",,democrats,1701156533.0,t3_185qffl
"Judge rejects Trump’s House January 6 committee subpoena request, calling it a ‘fishing expedition’",,democrats,1701155250.0,t3_185q49a
The Washington Post is very worried that American women don't want to marry Trump supporters,,democrats,1701145470.0,t3_185nh0e
Maddow mocks Georgia cities that will handcount ballots ' with a abacus and a My Pillow. This idea was hatched by one of the fake Republican electors.,"This should be interesting.  What could fail, lol? They can't even operate the voting machines without screwing up.",democrats,1701141994.0,t3_185me11
Biden to use cold war era law in a attempt to lower U.S. prices.,The man is constantly trying his best.,democrats,1701140563.0,t3_185lwgc
Florida’s voter suppression crucial to GOP edge in 2024,,democrats,1701136480.0,t3_185khnc
⚠️,,democrats,1701133316.0,t3_185jde0
Romney says any Democrat would be ‘an upgrade’ over Trump in 2024,,democrats,1701133475.0,t3_185jfde
"In 2024, Republican EV attacks may fall short as swing states reap investment",,democrats,1701128475.0,t3_185hjpe
More women denied abortions in Texas join lawsuit against the state,,democrats,1701124684.0,t3_185g0ul
So.. anyone know who this guy is?,I see him every time and have no idea who he is. Dying to know.,democrats,1701120398.0,t3_185e85f
Fascism’s most powerful backers: The Mercers may go all in on the coup-attempting Trump,,democrats,1701120898.0,t3_185efs7
"Majority of Black Americans see racist or negative depictions in news media, new study finds",,democrats,1701115023.0,t3_185c00i
Michigan Democratic Governor Whitmer Signs Bills Aiming to Codify Abortion Into State Law,,democrats,1701107257.0,t3_1858u6p
Dems Think They Can Send the Freedom Caucus Chair Packing,,democrats,1701106703.0,t3_1858m50
Trump Hints At Expanded Military Role Within The Country. A Legacy Law Could Let Him.,,democrats,1701103072.0,t3_185752m
Donations to GOP drop as worries mount about the party’s finances,,democrats,1701094167.0,t3_1853shm
"""Both Sides""",,democrats,1701073229.0,t3_184y4vf
"The ""Experts"" Be a Bit Slow",They just figured out Donnie poses a direct threat to the rule of law and democracy in the US?,democrats,1701052161.0,t3_184s6oj
"Biden to Skip U.N. Climate Summit, White House Says",,democrats,1701049924.0,t3_184rfou
"Perhaps one of the largest Biden Achievements, so often forgotten today",,democrats,1701039819.0,t3_184nqeg
"490,000 Florida residents moved out last year. The primary reasons are cost of living, especially housing and insurance",,democrats,1701036659.0,t3_184mghl
"I was doing a deep dive personal study on the Kent State protest shooting in 1970, and it really gave me a wake up call on how the GOP has been heavily demonizing Young Americans and college students for over 50 years plus, way before the advent of social media and the current “culture war”.","It really made me realize the 60’s and 70’s wasn’t all “counterculture” and that even the majority of American people at the time even blamed the students and still to this day. 

Just crazy to see how long the GOP has actively been demonizing younger people and college students who are more diverse and seek more education, especially with how out in the open it was before social media and Fox News etc.

 Another thing put into perspective for me with this issue not being something that became intensified or exclusive during my generation as a younger millennial being demonized by the GOP, but the fact it’s been so ongoing for decades and has been very out in the open. Recently read a few comments of student tour guides today on the Kent state campus who hear snarky and disgusting remarks from parents of the students who say the protestors shouldn’t have instigated the situation, or ”should have just followed the rules and it wouldn’t happen”.",democrats,1701033554.0,t3_184l69j
"Florida residents decry insurance ""nightmare"" as they flee state",,democrats,1701011150.0,t3_184cn2h
Nebraska activists launch effort to put abortion rights on the ballot next year,,democrats,1701001078.0,t3_1849hmh
"Judge in Trump civil fraud trial received hundreds of threats, court filing says |",,democrats,1700983596.0,t3_1845duo
Biden orders top aides to prepare reprimands for violent Israeli settlers in West Bank,,democrats,1700982313.0,t3_18452c0
Donald Trump's worst day yet in the New York civil fraud trial,,democrats,1700978956.0,t3_18447a9
Donor allegedly offered $20M to recruit a Tlaib primary challenger,,democrats,1700964178.0,t3_183zt1b
National Violent Death Reporting System. Includes D.C and PR.,Each state reports their Violent Deaths to the NVDRS.,democrats,1700963721.0,t3_183zng5
"FDR foretold our future. Why can't we have another progressive president like FDR again? Let's tax the rich 75%, institute social reforms like free healthcare and college. FDR gave us social security, it's past time for us to have access to free healthcare and college.",,democrats,1700963250.0,t3_183zi43
MAGA furious over Mitt Romney saying he'd vote for Democrats,,democrats,1700954945.0,t3_183woto
👍,,democrats,1700947416.0,t3_183tx8d
Donald Trump Stung by Court Filing on Thanksgiving,,democrats,1700945912.0,t3_183tcqu
Jewish family fled hometown after Mike Johnson warned of ‘enemy’ to the gospel: report,,democrats,1700941567.0,t3_183rsk5
Widespread election fraud claims by Republicans don't match the evidence,,democrats,1700939804.0,t3_183r5g6
Opinion | Trump won’t need more Black votes. He just needs Black voters to stay home again.,,democrats,1700936984.0,t3_183q3rr
Ignore the Media. Ignore the Polls. We are going to reelect the President.,,democrats,1700934630.0,t3_183p8sj
"Facing Rematch With Biden, Trump Stays Focused – on Obama",,democrats,1700932043.0,t3_183oag9
"Press “bothsideism” has failed Biden, and America (Brookings Institution article that is over a year old, but still very relevant)",,democrats,1700925679.0,t3_183lytg
Behold the Fox News Panel of Experts,,democrats,1700889203.0,t3_183c96p
Gov. Abbott appoints boards statewide,If ever there was a need to know this is it. I was researching Greg Abbott Judicial Appointments and found this list of board appointments he has made. Just when I thought it could not get worse. This is the extent of the take over in our daily lives in Texas and it is freakin scary. The source lists all the boards affected and has links to every position's Statute that gives him legal authority to make these appointments. Also Texas citizens can apply to be on those boards. https://gov.texas.gov/organization/appointments/application Source: https://gov.texas.gov/organization/appointments/positions.,democrats,1700885017.0,t3_183b1tj
If Democrats ran red states fewer people would die,,democrats,1700870400.0,t3_18362xq
SBA Announces Biden-Harris Administration’s Progress in Small Business Lending with End-of-Year Capital Program Numbers,"> Under Bidenomics agenda, agency has increased number and dollar amount of loans across several small business capital programs",democrats,1700866209.0,t3_1834gud
The Republicans Pushing To Investigate The Jan 6 Investigators All Played Parts In Efforts To Overturn The 2020 Election,,democrats,1700864022.0,t3_1833nzb
Recovery: The President has revealed his plan to win a second term.,,democrats,1700858529.0,t3_1831k9d
More GOP Voter Fraud,,democrats,1700854946.0,t3_18308pu
Ridley Scott on U.S. democracy,"“America I’ve always looked at as the epitome of democracy. And dude, at the moment, you still are — just. You’re really the only one in the world left at that level. It cannot slide any further sideways. It must not.”",democrats,1700844392.0,t3_182wbtq
Mike Johnson Spent Years Pushing Christian Speech In Public Schools,,democrats,1700836308.0,t3_182tdfj
Louisiana Democrat Wins Election By Just One Vote! Don't think your vote matters??Think again!!,,democrats,1700829375.0,t3_182r66h
Texas has the fewest personal freedoms,,democrats,1700809127.0,t3_182m5j4
New House speaker visits former President Trump in Florida,,democrats,1700801681.0,t3_182jzri
2020 Election Analysis: Teen Pregnancy (Texas edition),,democrats,1700800419.0,t3_182jmp7
"To the people who are considering not voting for Biden because he’s too old, just keep this in mind when you go to the ballot box next year",,democrats,1700771181.0,t3_182a3p0
BuT THe RIgHt tO BEar ArmS IS a COnStItUTIoNal RiGHt!!!,,democrats,1700764611.0,t3_1827tsx
Gov. Josh Shapiro thinks voters have Trump 'brain fog.' He wants Biden to refresh their memory.,Biden needs to do this ASAP!,democrats,1700760969.0,t3_1826guc
"How Biden shaped hostage negotiations with Israel, Hamas",,democrats,1700753681.0,t3_1823qvd
"Trump called Iowa evangelicals ‘so-called Christians’ and ‘pieces of shit’, book says | Books",,democrats,1700753353.0,t3_1823mmk
Proud of my pro-Palestinian peace President.,,democrats,1700728883.0,t3_181wsrl
Billionaires are lining up to eagerly fund Trump’s anti-democratic agenda | Robert Reich,,democrats,1700697862.0,t3_181ntzy
Yes People...Every..Vote..Counts!,,democrats,1700689843.0,t3_181ks4j
"Let's finish off this turkey, America!",,democrats,1700684322.0,t3_181ilts
The Red State Brain Drain Isn’t Coming. It’s Happening Right Now.,,democrats,1700684797.0,t3_181is5o
Texas anti-abortion group official arrested for allegedly soliciting a child,,democrats,1700684456.0,t3_181inmp
75% of New Yorkers Think Santos Should Resign From Congress: Poll,,democrats,1700684351.0,t3_181im7f
"With inflation cooling and AI hitting its stride, stocks are on the cusp of a record-setting ‘roaring 2020s,’ Ed Yardeni says",,democrats,1700684262.0,t3_181il2c
Doom and gloom was the ultimate goal — and now it is working: Trump wins with voter apathy,,democrats,1700682391.0,t3_181hv72
"The Red State Brain Drain Isn’t Coming. It’s Happening Right Now — As conservative states wage total culture war, college-educated workers, physicians, teachers, professors, and more are packing their bags.",,democrats,1700681579.0,t3_181hk7l
Russians ops,"I see this sub is frequented by Russian misinformation ops claiming they're just here to support the ""truth."" No real Dem would be perpetuating all these GQP narratives.",democrats,1700674126.0,t3_181em7x
Hijacking Government For Personal Vendettas Not Going Over Well For Gaetz In Florida,,democrats,1700670095.0,t3_181d25v
Gas prices: National average at lowest level of 2023 ahead of Thanksgiving weekend,,democrats,1700666341.0,t3_181bgn1
Many former Trump aides say he shouldn’t be president. Will it matter?,,democrats,1700663555.0,t3_181agh5
Statement from President Joe Biden on the Hostage Release in Gaza | The White House,,democrats,1700658264.0,t3_1818o0b
Donald Trump has worst day yet in NY civil fraud trial as underling's scribbled note ties him to conspiracy,,democrats,1700653779.0,t3_1817crj
Democrats nearly double Republicans in October fundraising,,democrats,1700635088.0,t3_1812vni
"If there’s one thing that’s going to boost young voter turnout for the party in 2024, it’s this","People are fed up with the GOP’s stance on abortion. I know some are panicking about Trump potentially winning and that’s understandable, but if he doubles down on banning abortion like the other GOP candidates have, it’s going to hurt him at the ballot box big time. In 2019 when his policies began to kick in, he promised to ban late term abortion and the next year he ended up losing in most of the states he carried in 2016. 

A couple weeks ago, we saw in Virginia and Ohio that if abortion is on the ballot, it’s more than likely going to tip the scales in favor of the Democrats. Some of the swing states that Biden won in 2020 like AZ, PA, and NV have put it on the ballot, so with increased voter turnout from young people like we saw in Ohio and Virginia, it’s very likely that he carries those states again. 

Again, this doesn’t mean we should get comfortable, but there’s nothing wrong with being optimistic. The most important thing you can do is get out and vote.",democrats,1700629403.0,t3_1811cxz
“What These Swing Voters Have To Say About The 2024 Election” — a maddening listen,"YIKES. This was a really frustrating listen. It’s hard to sit there and listen to people completely mischaracterize Trump, Biden, and the platforms of their parties, and act as if they are informed about anything they are talking about.

It is annoying to listen to people who clearly are NOT informed about politics try to justify their feelings. The people interviewed had NO idea who else is running in the Republican primary— and yet their opinions on “why Biden isn’t a good president” are supposed to hold weight? Yeah right.

The woman couldn’t even explain what she meant. The amount of “I don’t knows…. You know” or “I just want someone who is a good president” and then using that sentence to segue to why she is voting for Trump…? Absolutely delusional.

The first guy forgot who else he liked in the Republican primary (DeSantis), and when he remembered, said “I like how he is running Florida” — well, awesome. Can you provide any context of what you mean, or any specifics about what you like about HOW he is running Florida?

It is absolutely maddening to listen to this woman say “I want a president who wants what is best for our country” and then go on some uninformed rant about why that person is Trump and how Biden isn’t doing anything.

Clearly, these voters lack any sense of nuance or basic political common sense. What a frustrating listen to give such a platform to ineptitude. The smartest person interviewed in this podcast was the little boy at the end.",democrats,1700625818.0,t3_1810ck8
Biden is the best President of my life time - and I am old. We need to say it more.,,democrats,1700617888.0,t3_180xtfk
Cassidy Hutchinson Gives Dark Reason Why ‘Everybody Should Vote For Joe Biden’,,democrats,1700617215.0,t3_180xl8z
"In a major victory for Pennsylvania voters, a federal court ruled that officials must count mail-in ballots that are missing or have an incorrect date on the outer envelope",,democrats,1700608315.0,t3_180ugtx
Biden approval rating ticks up as voters rank stronger economy: Poll,,democrats,1700595330.0,t3_180pbr7
Name fits? Will MAGAs adopt it?,,democrats,1700593932.0,t3_180ortb
Federal appeals court ruling threatens enforcement of the Voting Rights Act,,democrats,1700575570.0,t3_180hrh9
"Joe Scarborough Calls Out Trump’s Fascism, MAGA Victimhood: ‘They Are Such Weak Snowflakes!’",,democrats,1700574698.0,t3_180hgbn
"Federal appeals court deals blow to Voting Rights Act, ruling that private plaintiffs can't sue",,democrats,1700570902.0,t3_180g7bx
Biden says hostage deal nearing. As US and other nations condemming Hamas. Ordering immediate release of hostages.,US and other countries working diligently for release of hostages. Iran as well as Arab nation orders Hamas for immediate release of hostages. They are fed up with what they did. President Biden is working tirelessly for the hostages.,democrats,1700540240.0,t3_1808c5j
"PA falsely says Oct.7 massacre was committed by IDF....Right out of the Republican playbook,lol.",This is what is going on domestically  and globally. Conspiracy Theories galore.,democrats,1700539272.0,t3_18081u3
How is it possible?,,democrats,1700537416.0,t3_1807glx
I compiled every 2022 proposal that favors Democrats into one map,,democrats,1700523165.0,t3_1802kwh
A Montana farmer with a flattop and ample lobbyist cash stands between the GOP and Senate control,,democrats,1700519859.0,t3_18019nj
Republicans Pushing To Investigate Jan 6 Investigators All Played Parts In Efforts To Overturn 2020 Election,,democrats,1700517846.0,t3_1800g37
"With losses looming elsewhere, national Democrats target Ted Cruz in Texas",,democrats,1700517655.0,t3_1800d36
Texas businesses say abortion ban costs state nearly $15 billion a year,,democrats,1700515628.0,t3_17zzhw2
This election is black and white; you either vote for Biden or teleport back to the Puritan days.,,democrats,1700511241.0,t3_17zxqxv
Why I Am a Liberal (Gift Article),,democrats,1700507059.0,t3_17zw2z6
Has Anyone Noticed That Trump Is Really Old?,,democrats,1700498019.0,t3_17zsiq8
Opinion | What Happens When the Super Rich Are This Selfish? (It Isn’t Pretty.),,democrats,1700491106.0,t3_17zpy2v
Arguments on putting Trump's gag order back in place are before an appeals court,,democrats,1700490332.0,t3_17zpofj
Richest 1% account for more carbon emissions than poorest 66% — The ‘polluter elite’ are plundering the planet to point of destruction,,democrats,1700487277.0,t3_17zomt5
Polls like these are great but we can’t allow the party to get complacent,"If we learned anything from last week, polls don’t decide elections, voters at the ballot box do. This race is pivotal for the party to win back the Senate seat changed to Independent by Sinema.

Also, the fact that people in Arizona are even considering voting for Lake after all the theatrics she pulled last year in the race for governor is astounding",democrats,1700470454.0,t3_17zk8md
A fading coal town hitches its hopes to Bill Gates’s clean-energy dream,,democrats,1700480433.0,t3_17zmn7y
Opinion | Democrats are the true majority in the House,,democrats,1700461184.0,t3_17zi34g
Trump’s extreme rhetoric conjures the prospect of a presidency like no other,,democrats,1700453294.0,t3_17zfx0e
Trump allies pre-screen loyalists for unprecedented power grab,,democrats,1700446669.0,t3_17zdsw6
Dropped my MIL off and saw this nearby...,,democrats,1700437351.0,t3_17zal3g
First Lady Rosalynn Carter 😭😭😭,"Rest in Peace, Mrs Carter.  You will be missed 😢",democrats,1700425752.0,t3_17z64bx
"Rosalynn Carter, former first lady and tireless humanitarian who advocated for mental health issues, dies at 96",,democrats,1700425588.0,t3_17z626d
"Rosalynn Carter, first lady who championed mental health, dies at 96",,democrats,1700425480.0,t3_17z60r0
Can a socialist ex-marine fill Joe Manchin’s seat in West Virginia?,,democrats,1700411479.0,t3_17z0wsy
"""We should be unfaithful to ourselves if we should ever lose sight of the danger to our liberties if anything partial or extraneous should infect the purity of our free, fair, virtuous, and independent elections."" - John Adams, Inaugural Address, 1797",,democrats,1700413952.0,t3_17z1ssa
Liberals have fared well in recent elections. Does that mean a Democrat could unseat McMorris Rodgers?,,democrats,1700412015.0,t3_17z13om
Tempers flare and bills languish as Speaker Johnson confronts the same problems that vexed McCarthy,,democrats,1700403481.0,t3_17yy5cu
Pink hits back at DeSantis book bans by giving away books at Florida concerts,,democrats,1700399844.0,t3_17yx0bj
