title,selftext,subreddit,created_utc,name
Race to Replace George Santos - NY3 Special Election Forecast and Polling,,democrats,1702310171.0,t3_18fxpot
"GOP Sen. Mitt Romney doesn’t rule out voting for Biden, says Trump has ‘authoritarian’ interests",,democrats,1702309141.0,t3_18fxbpp
"Mike Johnson is evil and controlled by the devil, says Christian minister",,democrats,1702307438.0,t3_18fwotf
Democrats need to release the J6 footage - WITHOUT Blurred Faces of the Criminals,"Fight fire with fire.

https://www.theguardian.com/us-news/2023/dec/06/mike-johnson-january-6-blur-faces-footage",democrats,1702282586.0,t3_18fpowa
GOP Vance seeks investigation into op-ed (WP) that criticized Trump and the possibility of a Republican dictatorship.," V.D Vance is a clown sycophant. Remember  Kagan is protected by the first amendment. He wants to complain about Kagan's op-ed, lol. He should look no further than his God, DJT. Wasting more tax payer dollars.",democrats,1702270647.0,t3_18fmq0c
Young People Are Not Apathetic About Voting,"Despite holding the majority in the House, the GOP isn’t doing anything to address young people’s most specific concerns — whether it’s gun violence, climate change or student loans. Instead, the party — often behind closed doors — is taking a page out of the anti-democracy playbook. That is, Republicans are currently waging a sustained, intense and targeted war to disenfranchise young people in 2024.",democrats,1702263758.0,t3_18fkpdr
💉,,democrats,1702248743.0,t3_18ffrns
Biden dings Trump on infrastructure while he showcases $8.2B for 10 major rail projects.,President Biden delivering what TFG couldn't.,democrats,1702249818.0,t3_18fg5kp
Biden's big money campaign fundraisers.,Biden raising funds for what's going to be an expensive campaign.,democrats,1702244713.0,t3_18fe9tw
⚠️,,democrats,1702233848.0,t3_18fa7od
Thanks Illinois Democrats! A. New slate of progressive initiatives will be Illinois law in 2024!,"Starting in 2024:

“HB 2068 – All employers with 50 or more employees, and that are located within one mile of regularly-scheduled transit service, will be required to allow eligible employees to exclude public transit costs from their taxable wages.”

HB 2123 – The “Digital Forgeries Act” holds that individuals have a right to legal recourse if they are the target of “deep fakes” or digitally-altered sexual images.  

HB 2493 – All employees in Illinois will now have unpaid leave of up to two weeks in the event a family or household member is killed in a crime of violence.

HB 2719 – Hospitals will be legally required to screen patients for eligibility for financial assistance before sending them to collections.

HB 3236 – Contracts, transactions and agreements that extend credit to a consumer to purchase a dog or cat will be null and void.

SB 1463 – Fees and fines can no longer be assessed in Illinois to individuals under the age of 18, except for traffic tickets, boating or fishing violations, or municipal ordinance violations",democrats,1702234343.0,t3_18fae21
Biden's focus on bashing Trump takes a page from the winning Obama and Bush reelection playbooks,,democrats,1702228740.0,t3_18f8ccz
Republican abandonment of Ukraine signals to Taiwan that the U.S. would abandon that ally too.,,democrats,1702217530.0,t3_18f4g2p
Major changes to US immigration policy are under discussion. What are they and what could they mean?,,democrats,1702214701.0,t3_18f3kaa
Florida SAT scores drop again while Republican politicians wage culture wars,,democrats,1702213080.0,t3_18f32rd
New poll shows widening gap in California’s U.S. Senate race,,democrats,1702187269.0,t3_18ewqhf
Thanks scotus,,democrats,1702184526.0,t3_18ew0cj
Sex scandalized GOP official reportedly cites Trump values as new Republican standard,,democrats,1702184045.0,t3_18evvfl
The best leader,,democrats,1702181957.0,t3_18evb7g
Democratic former Rep. Tom Suozzi launches campaign for George Santos’ House seat,,democrats,1702177455.0,t3_18eu21k
"John Whitmire, a Moderate Democrat, Wins Runoff for Houston Mayor",,democrats,1702174811.0,t3_18etag2
California holds the key to GOP power in the House. McCarthy's retirement makes everything harder,,democrats,1702146064.0,t3_18ejklt
Pink Praises Hometown for Voting Out Book-Banning School Board,,democrats,1702141613.0,t3_18ehzrk
"How a factory city in Wisconsin fed military-grade weapons to a Mexican cartel - Members of a local family, working with a cousin in Mexico, enlisted friends and relatives who bought guns on their behalf in Racine and transported them to California and south across the border",,democrats,1702135587.0,t3_18efvbf
"The Trump Fiasco Unveiled: Expert Witness Bags Lavish $877,500 in Defense",,democrats,1702131824.0,t3_18een03
Nikki Haley's Says She's A Proud ‘Union-Buster’,,democrats,1702130750.0,t3_18eeaz6
Texas Supreme Court temporarily halts order that allowed pregnant woman to have abortion,,democrats,1702125257.0,t3_18ecp77
"Biden won't pardon his son if he's convicted, White House says (Would it help?)",,democrats,1702105721.0,t3_18e7y74
Biden mocks Trump during California fundraising trip,,democrats,1702102478.0,t3_18e75lc
Prosecute him,,democrats,1702101834.0,t3_18e6zp2
Texas Supreme Court pauses lower court's order allowing pregnant woman to have an abortion,,democrats,1702095850.0,t3_18e5d0p
"Megyn Kelly: ""No Question"" Trump is in Cognitive Decline",,democrats,1702077268.0,t3_18dzhew
Biden heads to California for big Hollywood money haul — a top campaign official boasted it will rake in a record amount of cash for the Democratic U.S. president's 2024 reelection effort,,democrats,1702078698.0,t3_18dzz90
"Texas AG Ken Paxton files petition to block Kate Cox abortion, despite fatal fetal diagnosis",,democrats,1702075970.0,t3_18dz0p6
Federal Appeals Court Upholds Gag Order on Trump,,democrats,1702073559.0,t3_18dy5av
Dominion wins access to Newsmax journalists' texts in its defamation case,,democrats,1702073487.0,t3_18dy4du
💲,,democrats,1702072245.0,t3_18dxoc1
Kevin McCarthy finally admits the truth,,democrats,1702071135.0,t3_18dx9xk
Like clockwork with these people,,democrats,1702066463.0,t3_18dvjj3
Column: Hardscrabble trailblazer Toni Atkins would be an intriguing candidate for California governor,,democrats,1702063649.0,t3_18duhrt
I Was Obama's 2012 Campaign Manager. There's No Need to Panic Over Biden,,democrats,1702061527.0,t3_18dtpvn
Trump's 2023 Evaluation,,democrats,1702054677.0,t3_18dr7gc
Trump promises a war on blue America,,democrats,1702050411.0,t3_18dpn31
Florida Democrats pen letter calling for DeSantis to end book bans | The Hill,,democrats,1702049054.0,t3_18dp5pw
"President Biden Confronts Trump's Past Muslim Ban, Champions Unity and Rejects Bigotry",,democrats,1702048903.0,t3_18dp3sm
"Republican Adam Kinzinger says he's politically ""homeless,"" and if Trump is the nominee, he'll vote for Biden",,democrats,1702048464.0,t3_18doyce
"US Labor Market Strengthens as Hiring Gains, Unemployment Falls",,democrats,1702044159.0,t3_18dnhhc
Democrats' bold strategy could upend GOP primaries,,democrats,1702043422.0,t3_18dn8lq
A List of Trump’s “Unprecedented Steps” for the LGBTQ Community,,democrats,1702042357.0,t3_18dmwhm
Texas’s Attorney General Has a Ghoulish New Abortion Stance,"This is what Texas has become, and this is the future the GOP envisions for America.",democrats,1702034470.0,t3_18dkqjh
'Dangerous': Vivek Ramaswamy slammed for 'great replacement’ theory remark by former GOP congressman,,democrats,1702011594.0,t3_18df794
"Putin allies jubilant as US Republicans balk on Ukraine aid, report says",,democrats,1702010989.0,t3_18df0wf
"Biden meets with leaders of tribal nations, signs order easing access to federal funds -",,democrats,1702003830.0,t3_18dct1m
Fetterman defends 'reasonable' border talks as fellow Dems fume,,democrats,1702003063.0,t3_18dckb2
New York Democrats pick Tom Suozzi as their candidate for George Santos’ seat,,democrats,1701991377.0,t3_18d8oxo
"PornHub Makes You Gay or Trans, Conservative ‘Daily Wire’ Pundit Michael Knowles Claims",,democrats,1701989443.0,t3_18d7zt3
George Santos Is Raking in a Disgusting Amount of Money on Cameo,,democrats,1701988577.0,t3_18d7obv
A deluge of violent messages: How a surge in threats to public officials could disrupt American democracy,,democrats,1701985744.0,t3_18d6lrk
Trump says ‘I’m not a dictator’ but top figures warn of authoritarian takeover,,democrats,1701979760.0,t3_18d4aof
America!,,democrats,1701978899.0,t3_18d3ymp
Pennsylvania School District Quickly Reverses Far-Right Policies Under Democratic Control,,democrats,1701977659.0,t3_18d3htf
Best quote from Harry Potter to describe the other side,,democrats,1701971355.0,t3_18d152j
Democratic Legislative Campaign Committee Announces First 2024 Battleground State Investments,,democrats,1701968648.0,t3_18d05e0
VIDEO: George Santos Sends Words of Encouragement to Florida Rep. Fabián Basabe,,democrats,1701966499.0,t3_18czcur
Vivek Ramaswamy Accuses Fellow Republicans of “Licking Donald Trump’s Boots” in Fiery Presidential Debate,,democrats,1701957824.0,t3_18cw9oy
School board member sworn in on pile of banned books to troll Moms for Liberty,,democrats,1701952137.0,t3_18cuk1j
Texas lawmaker wants to know why active shooter alert wasn't issued during shooting spree,,democrats,1701937847.0,t3_18cr76o
What to Know About the Texas Woman Suing the State to Get an Abortion,,democrats,1701936615.0,t3_18cqx0y
"Targeting costly meds, Biden admin asserts authority to seize certain drug patents",,democrats,1701927602.0,t3_18coo97
New York candidate running to replace George Santos convicted over U.S. Capitol riot,,democrats,1701926015.0,t3_18co83i
🤮,,democrats,1701924235.0,t3_18cnovv
Nearly $5 billion in additional student loan forgiveness approved by Biden administration,,democrats,1701918067.0,t3_18clsg3
Trump allies craft plans to give him unprecedented power if he wins the White House,,democrats,1701908448.0,t3_18cim4c
Disgraced Ex-Speaker Kevin McCarthy Announces Early Retirement,,democrats,1701901423.0,t3_18cg1jh
Student loans: Biden administration discharges additional $4.8 billion in student debt,,democrats,1701900698.0,t3_18cfrtc
The Media Bias Chart Adds 10 Sources to December’s Web Edition,,democrats,1701900417.0,t3_18cfnxo
"Special Counsel Drops Bombshell: Trump and Co-Conspirator Plotted to 'Cause a Riot to Disrupt the Count' in Detroit, Explosive Evidence Reveals",,democrats,1701899863.0,t3_18cffvt
"Florida AG Says School Libraries Are for “Government Speech,” Not Free Expression",,democrats,1701896661.0,t3_18ce6va
Biden forgives another $5 billion in student loans,,democrats,1701896177.0,t3_18cdzz7
Donald Trump's Team Suffers 'Clueless' Moment in Court,,democrats,1701895620.0,t3_18cds58
"Wisconsin Trump electors settle lawsuit, agree Biden won in 2020",,democrats,1701890794.0,t3_18cbwrl
Central Bucks school board president Karen Smith sworn in on banned books,,democrats,1701885910.0,t3_18ca0dp
Top Democratic donor gives $250k to support Nikki Haley,,democrats,1701884743.0,t3_18c9jjt
Georgia prosecutor dismisses Trump attorney’s claim that proposed August trial date amounts to election interference,,democrats,1701884007.0,t3_18c998d
"Former speaker Kevin McCarthy will retire from Congress at end of year. With Santos expulsion, further narrows GOP House majority",,democrats,1701883023.0,t3_18c8vbn
"Kevin McCarthy, Former Speaker of the House, Says He's Quitting Congress",,democrats,1701882359.0,t3_18c8lv0
Donald Trump Declares He’d Be Dictator ‘On Day One’ if Reelected,,democrats,1701881386.0,t3_18c888o
Kevin McCarthy to resign from Congress at end of December,,democrats,1701880905.0,t3_18c81sw
Golden Gavel for Kamala,,democrats,1701878629.0,t3_18c771r
Vice President Harris broke a 191-year-old record for casting the most tiebreaking votes in the Senate when she voted Tuesday to advance the confirmation of a new federal judge in D.C.,Senate Majority Leader Chuck Schumer presented Vice President Kamala Harris with a golden gavel after she cast her 32nd tie-breaking vote in the Senate on Tuesday.,democrats,1701875590.0,t3_18c62ru
The Republican plan to outlaw abortion everywhere,,democrats,1701875841.0,t3_18c6628
"Trump’s defense at civil fraud trial zooms in on Mar-a-Lago, with a broker calling it ‘breathtaking’",,democrats,1701875156.0,t3_18c5xbh
Shame on anyone that surprised by what happens if Trump is elected for a second term.,,democrats,1701872427.0,t3_18c4yuv
Trump declines to rule out abusing power to seek retribution if he returns to the White House,,democrats,1701868741.0,t3_18c3szo
Absolutely right,,democrats,1701861186.0,t3_18c1qb7
I need help with a debate…,"Hey I know this has nothing to do with the convo, but I was debating a conservative recently and they were saying representation in school teachings doesn’t matte, and they are gonna homeschool their kids. They also said they are going to teach their kids about other people by going outside and gaining real life experience.

We were debating on trans representation in schools. They were saying it shouldn’t matter and I was saying it should. How do I argue my point?",democrats,1701853691.0,t3_18c01mt
"Biden condemned the ""unimaginable cruelty"" of Hamas attackers. They raped and mutilated women.",The women were brutally raped to death. Mutilated and their pelvis bones destroyed.,democrats,1701844661.0,t3_18bxzzw
Biden condemned the rapes and mutilation of women by Hamas.,,democrats,1701846336.0,t3_18byej8
Liz Cheney: ‘Rep. Mike Johnson was desperate for Donald Trump’s approval’,,democrats,1701838720.0,t3_18bwd4g
"Trump Unleashes Bizarre Tirade Against NY Attorney General Letitia James, Falsely Claims Victory in Legal Battle While Spreading Wild Accusations on Truth Social",,democrats,1701831824.0,t3_18bu835
Giuliani’s no-show prevents courtroom confrontation with Georgia election workers,,democrats,1701821355.0,t3_18bqpaz
US House Republican Patrick McHenry won't seek re-election 🎉,,democrats,1701820447.0,t3_18bqdab
Kids in cages again,"As most of you know, Republicans are pushing for anti immigrant legislation in exchange for Ukraine and Israel aid. https://thehill.com/blogs/blog-briefing-room/4342148-bolton-says-he-thinks-ukraine-aid-will-be-tied-to-immigration-reform/. There is a lot of opposition to this from within the Dem caucus, but also seems like the leadership would not need them to pass this, just blue dog Dems and R votes. 

Do we think the party leadership will go this way? I think it would be suicidal for reelection chances.",democrats,1701813562.0,t3_18bnn77
When can we expect this to be implemented?,"We have control over Virginia Legislature but it has a republican governor

I expect the following states to adopt the agreement within the coming 5 years or so:

1. Michigan
2. Pennsylvania
3. Virginia 
4. Possibly North Carolina

Comment your thoughts",democrats,1701811529.0,t3_18bmtoo
Florida Democrats Call for GOP Chair and His Wife to Resign Over Sex Assault Allegations & ‘Staggering Hypocrisy’,,democrats,1701812153.0,t3_18bn2pf
Biden Administration releases draft student debt forgiveness proposal,,democrats,1701810431.0,t3_18bmdw2
How do you feel America compares to other countries in terms of racism and openness to outsiders?,"This article covers people's views on our country, but how do you feel we compare to other places? Top 10 percent of racist countries worldwide? Bottom 10%? Somewhere in the middle?",democrats,1701808103.0,t3_18blgii
Shock poll gives Independent challenger lead in state Donald Trump won by 19 points,,democrats,1701807424.0,t3_18bl6x4
Vice President Harris breaks record for casting the most tie-breaking votes,,democrats,1701803612.0,t3_18bjogd
Trump Hits Back at Liz Cheney by... Admitting He Eats Too Much?,,democrats,1701800623.0,t3_18bijah
Why are people Blue Dog Democrats?,"For those who are fiscally conservative and socially liberal or socially conservative and fiscally liberal, why do you vote Democrat? I am just curious.",democrats,1701796826.0,t3_18bh26m
Moms for Liberty Sex Scandal Causes Pennsylvania Chapter to Split From National Group,,democrats,1701799434.0,t3_18bi2ch
Why Does it Take Liz Cheney to Say What Biden and All Democrats Should Be Saying?,,democrats,1701798533.0,t3_18bhpmm
"Florida abortion measure tops 621,000 signatures, but more are needed before the Feb 1st Deadline",,democrats,1701794222.0,t3_18bg2em
Supreme Court to hear case that could make it harder for Congress to tax the rich 🤮,,democrats,1701790311.0,t3_18beh3n
Unmasking George Santos: Inside ‘The Fabulist’ With Author Mark Chiusano,,democrats,1701777817.0,t3_18bais8
Well stated,,democrats,1701762755.0,t3_18b70d7
It’s Time to Run Moms for Liberty’s Bridget Ziegler Out of Politics,,democrats,1701753629.0,t3_18b4nwl
Graham responds to Cheney’s dire warnings about second Trump term 🤡🤡🤡🤡🤡,,democrats,1701745692.0,t3_18b27ol
[Mod Approved] Thank you everyone for helping! I'm looking for 2 more responses for my thesis research before I can move on to data analysis. Anyone willing to take a 10 minute survey discussing media habits and views on crime and criminal justice would be appreciated!,,democrats,1701743203.0,t3_18b1dyw
this post is both hilarious and sad.,,democrats,1701734338.0,t3_18ayauc
"Trump Reposts Article: ""A Trump Dictatorship is Increasingly Inevitable""","The WAPO article, posted by Rep. Cory Mills, warns Trump could win and refuse to leave office",democrats,1701728523.0,t3_18aw3bm
Feds have charged more than 250 people under new gun trafficking law,,democrats,1701724027.0,t3_18aucy0
Georgia Republicans target Democrat’s district in new state congressional map,,democrats,1701721394.0,t3_18atbuo
"Yes, George Santos Is Charging $200 on Cameo, Makes One for Democratic Senator",,democrats,1701720274.0,t3_18asw1d
Members of Texas Republican party free to associate with Nazi sympathizers,,democrats,1701719501.0,t3_18asku1
"Dozens of Troops Suspected of Advocating Overthrow of US Government, New Pentagon Extremism Report Says",,democrats,1701712698.0,t3_18apwj8
Mike Johnson claims to hate the devil. Maybe he should look in the mirror,,democrats,1701706747.0,t3_18ano3k
Trump Takes A One-Two Gut Punch On Presidential Immunity,,democrats,1701704782.0,t3_18amy3q
"Exclusive: Liz Cheney’s new book blasts GOP as ‘enablers and collaborators’ of Trump, whom one member called ‘Orange Jesus’ | CNN Politics",,democrats,1701702606.0,t3_18am70j
The rape victim behind Kentucky’s viral abortion ad. She helped Democratic Gov. Andy Beshear win reelection — and she’s ready to campaign again in 2024.,,democrats,1701701154.0,t3_18alp6e
"Jen Psaki Destroys Trump's Delusional Rant, Exposes Authoritarian Agenda Threatening Democracy",,democrats,1701698277.0,t3_18akqxn
Got your answer right here!,,democrats,1701666205.0,t3_18acw0o
It's that simple.,,democrats,1701663939.0,t3_18ac8hj
"US warship and 3 commercial carriers attacked by Houthi rebels in Yemen, US military says",,democrats,1701664712.0,t3_18acgbk
"Former US ambassador arrested in Florida, accused of serving as an agent of Cuba, AP source says | AP News",Florida has turned into a cesspool of criminals,democrats,1701664109.0,t3_18aca54
Biden used to keep quiet about Trump. Now he's sounding the alarm on Trump,"Let's go President Biden.  Let's go Democrats. Let's help the president by making sure we are ready to vote on Nov, 5 2024.",democrats,1701652459.0,t3_18a8pbk
Liz Cheney's book on taking on Trump and his enablers.,Thank's to her courage. We saw who the traitors to our constitution were.,democrats,1701648436.0,t3_18a7dh3
"The Gay Candidate Who Could Flip a California Congressional Seat for the Democrats — Will Rollins lost a close race against Republican Ken Calvert in 2022, but 2024 may well bring a different outcome.",,democrats,1701642034.0,t3_18a52kd
[Mod Approved] Thank you everyone for helping! I'm looking for around 20 more responses for my thesis research before I can move on to data analysis. Anyone willing to take a 10 minute survey discussing media habits and views on crime and criminal justice would be appreciated!,,democrats,1701631166.0,t3_18a0v7t
"‘Time to Be Bold’: Advice for Democrats from a Quietly Powerful Governor. As the new chair of the Democratic Governors Association, Gov. Tim Walz has some tips for the party.",,democrats,1701631837.0,t3_18a14ge
House GOP’s majority hinges on New York,,democrats,1701630229.0,t3_18a0ir2
Trump calls on supporters to 'guard the vote' in Democratic-run US cities,,democrats,1701629715.0,t3_18a0bv4
‘Damning’: New Pence notes point to GOP senator's role in Jan. 6 plot,,democrats,1701628420.0,t3_189zt7j
Opinion | A Trump dictatorship is increasingly inevitable. We should stop pretending.,,democrats,1701627925.0,t3_189zmop
Donald Trump Vows To Restore Muslim Ban - MeidasTouch Network,Trump continues to espouse Islamophobia on the campaign trail,democrats,1701624840.0,t3_189yhpa
‘Plain historical falsehoods’: How amicus briefs bolstered Supreme Court conservatives,,democrats,1701619327.0,t3_189witp
GOP lawmakers cautiously open to Trump's ACA repeal push,,democrats,1701617095.0,t3_189vqse
Supreme Court to consider hearing Jan. 6 cases that could affect Trump prosecution 🤮,,democrats,1701581059.0,t3_189mi0q
"VP Harris calls on Israel to respect international law, stop killing innocent Palestinians",,democrats,1701571701.0,t3_189jqud
Major news outlets gave much less coverage to Trump’s “vermin” attack than they did Clinton’s “deplorables” remark,,democrats,1701556534.0,t3_189eyx3
America 'Sleepwalking into Dictatorship,,democrats,1701551864.0,t3_189ddzm
Appeals court orders Texas to remove buoy barrier on the Rio Grande border,,democrats,1701540001.0,t3_18997yl
"Trump’s Second-Term Plans: Anti-‘Woke’ University, ‘Freedom Cities’",,democrats,1701536095.0,t3_1897u1f
Florida’s got 99 problems and Ron DeSantis is responsible for every single one - Florida Democratic Party,,democrats,1701531622.0,t3_1896b7n
Sounds about right for them.,,democrats,1701525398.0,t3_18949t0
Federal Appeals Court Delivers Massive Legal Blow to Donald Trump in Capitol Police Lawsuits,,democrats,1701526065.0,t3_1894hpr
🙋‍♀️,,democrats,1701497239.0,t3_188x90a
Rep. Swalwell: Trump ‘facing tapestry of accountability’ in court cases,,democrats,1701493239.0,t3_188w4f5
DeSantis finally got to debate someone on covid. It didn’t go well.,,democrats,1701481979.0,t3_188soa8
Here are six culprits who seem to think 2024 is just another election,,democrats,1701472119.0,t3_188p7zf
⚠️,,democrats,1701468566.0,t3_188nwsg
The only reason the GOP allowed the Democrats to vote Santos out of Congress is because Santos stole from his fellow Republicans,,democrats,1701464906.0,t3_188mhzy
Democrats delivering for small business.,,democrats,1701456293.0,t3_188j7x2
Only a matter of time before they're all out of office,,democrats,1701456622.0,t3_188jcby
"As George Santos is expelled from Congress, Brazilians hang their heads",,democrats,1701455277.0,t3_188itm2
George Santos Is Gone. Two Dozen Candidates Want His Seat.,A special election will fill his seat. NY Democrats need to find a way to win.,democrats,1701454711.0,t3_188ilg2
Mad Poll Disease is making Democrats misread voter opinion | Michael Podhorzer,,democrats,1701451408.0,t3_188hanu
"Florida GOP Power Couple hit With Allegations of Rape, ThreeWay Lifestyle",,democrats,1701453366.0,t3_188i2c2
"George Santos, the Fabulist Lawmaker, Is Expelled from Congress",,democrats,1701447155.0,t3_188fnde
"Sandra Day O’Connor, the first female Supreme Court justice, dead at 93",,democrats,1701447034.0,t3_188flnw
Rep. George Santos expelled from Congress on bipartisan vote,"Bye, Felicia.",democrats,1701446667.0,t3_188fgj6
George Santos Expelled From Congress,,democrats,1701446659.0,t3_188fgf5
"Buh-bye, George Santos",,democrats,1701446305.0,t3_188fb20
"Trump can be held civilly liable in Jan. 6 riot, judges rule",,democrats,1701444232.0,t3_188eid6
Allegory of the Cave and MAGA,,democrats,1701443983.0,t3_188eexc
Gun violence as a public health crisis explored by Senate Democrats,,democrats,1701443310.0,t3_188e5pm
John Cornyn and Ted Cruz flee U.S. Senate hearing as Democrats vote on Harlan Crow subpoena | All 11 Democrats voted to authorize the subpoena and declared the move adopted.,,democrats,1701424146.0,t3_188834x
"Watch DeSantis' face as Gavin Newsom demolishes the GOP's ""parental rights"" talking point",,democrats,1701404876.0,t3_1882wtm
Fox News hiding Ron DeSantis's riser boots,Gotta love the intentional graphic placement and camera angle to ensure no one sees Lil Ron DeFascist's riser boots. What an absolute clown show of a network.,democrats,1701397776.0,t3_1880kjl
Biden campaign prepares legal fight against election deepfakes,,democrats,1701396560.0,t3_18805er
Texas homeowners see skyrocketing insurance rates this year,,democrats,1701394972.0,t3_187zlea
"FOX News Blasts Cars that Could Control Speeding: ""Forget Your Constitutional Rights!""",,democrats,1701394856.0,t3_187zjz7
"Sexual Assault, Secret Throuple: New Allegations Against Florida GOP Power Couple, Moms for Liberty Co-Founder",,democrats,1701394245.0,t3_187zbtc
Who's tuning in for THIS delightful romp?,,democrats,1701392398.0,t3_187yndk
Trump financial watchdog informs judge of $40 million in undisclosed cash transfers,,democrats,1701390159.0,t3_187xtlk
"A Florida GOP Leader, a Moms for Liberty Founder, and Allegations of Group Sex and Rape",,democrats,1701386462.0,t3_187wf3h
"Newsom versus DeSantis: How, when and where to watch the governors debate — The program is set to begin at 6 p.m. Pacific. The debate will also be broadcast on Fox News Radio and livestreamed on FoxNews.com, but a cable subscription is required.",,democrats,1701381188.0,t3_187ub2f
