title,selftext,subreddit,created_utc,name
College student in need of a Democrat’s perspective for an assignment!,"
Hey all,

If this post isn’t allowed I’ll take it somewhere else. I’m in college, taking an honors political science course that focuses specifically on the right side of the political spectrum and its foundations / futures, then the lefts, then how the two interact, as well as polarization as a whole. One of my major assignments is to interview someone on the right, and someone on the left. While I interviewed my dad for the right, none of my relatives are liberal / democrat, and I live in the middle of nowhere so that’s also not helping. All it’ll be is just me asking a couple questions, and you providing your input. (More details the better). You must *explicitly* politically identify as one of the following: democrat / liberal / left leaning, otherwise it won’t count for the assignment. If anyone is able to, I’d be eternally grateful. Its currently 11:20 pm on 11/18 and I’m about to head to bed, this assignment is due at 11:59 on the 19th so the sooner I get a response the better. I hope to see someone soon!",democrats,1700371387.0,t3_17ypud9
"U.S., Israel and Hamas reach tentative deal to pause conflict and free dozens of hostages- WaPo",,democrats,1700362081.0,t3_17yn6ht
I think it’s ridiculous people are saying we need to primary him,,democrats,1700349261.0,t3_17yiw09
Democrats need to let Trump supporters see this,,democrats,1700346633.0,t3_17yhxh9
WaPo Opinion | Joe Biden: The U.S. won’t back down from the challenge of Putin and Hamas,,democrats,1700340535.0,t3_17yfn9f
Donald Trump poses the biggest danger to the world in 2024,,democrats,1700336515.0,t3_17ye80x
The flood of congressional retirements is rocking the 2024 elections,,democrats,1700332784.0,t3_17ycwfn
Officials stock up on overdose antidote naloxone after fentanyl-laced letters disrupt vote counting,,democrats,1700317942.0,t3_17y7owb
Texas Faces Threat of Blackouts After Grid Fails to Secure New Power Supply,,democrats,1700288496.0,t3_17y07xn
